"0","Civil in step guess pattern","339.53","Deal imagine indicate region different leave act range live along front sit your work plant off to several test","1","true","Electronics","https://picsum.photos/200/200/?random=0"
"1","Still thousand season","341.11","Walk couple field eight member want affect can doctor interesting religious or participant tax","1","true","Fashion and Apparel","https://picsum.photos/200/200/?random=1"
"2","Sister view the mission","439.65","Themselves leader hear cause figure though program arrive idea it tree onto situation star although skill me movement hand since become black reflect","1","false","Home and Garden","https://picsum.photos/200/200/?random=2"
"3","Author vote Republican","73.91","Likely improve good save return father they hear very during current price trouble if example treatment together","1","true","Home and Garden","https://picsum.photos/200/200/?random=3"
"4","Together painting value alone","96.62","Position animal close subject hard usually direction campaign Congress push modern young century again always","1","true","Fashion and Apparel","https://picsum.photos/200/200/?random=4"
"5","Him local sing money buy","237.06","Low approach case reflect world visit which lead probably base open scene today bar including even break doctor song new","1","true","Books and Media","https://picsum.photos/200/200/?random=5"
"6","Machine strong","224.25","Culture final might before series hotel community two back better our authority","2","false","Home and Garden","https://picsum.photos/200/200/?random=6"
"7","Seek plan","299.99","Mission score stay question population process future else establish process almost give line go trade control should two meet other close every just least","1","false","Fashion and Apparel","https://picsum.photos/200/200/?random=7"
"8","Produce cause especially","240.44","Century go east trip election could off just within threat black president","2","false","Home and Garden","https://picsum.photos/200/200/?random=8"