"0","Civil in step guess pattern","339.53","Deal imagine indicate region different leave act range live along front sit your work plant off to several test","true","Electronics","https://picsum.photos/200/200/?random=0"
"1","Reduce still","454.34","Program behind number alone join be part allow say project base capital significant seat traditional goal deal western","false","Health and Beauty","https://picsum.photos/200/200/?random=1"
"2","The mission","439.65","Themselves leader hear cause figure though program arrive idea it tree onto situation star although skill me movement hand since become black reflect","true","Books and Media","https://picsum.photos/200/200/?random=2"
"3","Deal important current seven","365.29","Pass federal church strong every red however draw ten reflect including phone carry window sell statement deal style fish future property them radio face","false","Fashion and Apparel","https://picsum.photos/200/200/?random=3"
"4","Relationship no","107.47","Usually direction campaign Congress push modern young century again always car strategy television put him local sing money buy leg still fire take","false","Fashion and Apparel","https://picsum.photos/200/200/?random=4"
"5","World visit which","233.41","Base open scene today bar including even break doctor song new natural discuss","true","Books and Media","https://picsum.photos/200/200/?random=5"
"6","Strong just ability dinner","311.66","Before series hotel community two back better our authority hotel ever seek plan one quickly mission","false","Electronics","https://picsum.photos/200/200/?random=6"
"7","Side after art tell","206.44","Line go trade control should two meet other close every just least","true","Home and Garden","https://picsum.photos/200/200/?random=7"
"8","Record produce cause","138.57","Generation across crime reduce analysis affect task trip already employee grow ok physical who establish husband heavy stuff cover training product majority rest culture","true","Home and Garden","https://picsum.photos/200/200/?random=8"
"9","Whose choose second listen","489.38","Early wait agency change should event trouble image wind party enough risk whether board happen gas million such region over return","true","Home and Garden","https://picsum.photos/200/200/?random=9"
"10","Mention fire","266.95","Performance gas wind specific general must their form job fall do movie black everything be student treatment","true","Health and Beauty","https://picsum.photos/200/200/?random=10"
"11","Nation bar defense brother","166.70","Future walk child loss our hold discuss anything own generation note quite","false","Electronics","https://picsum.photos/200/200/?random=11"
"12","Side part west hold","235.87","Factor camera agree direction service ask behavior financial front relate investment both bill situation war way happy bad economic voice trial push simply research","true","Home and Garden","https://picsum.photos/200/200/?random=12"
"13","Decision sport","315.89","Draw opportunity station ability suffer professional tough adult possible six life see past money generation star difficult sea other set meet civil avoid material","false","Health and Beauty","https://picsum.photos/200/200/?random=13"
"14","Effort school about television","332.62","Would author pressure allow general nice lot job visit third three sister cut product have threat general others","true","Home and Garden","https://picsum.photos/200/200/?random=14"
"15","Building ground establish","179.51","Teacher once style measure use education too nor book list fire develop skin collection","true","Health and Beauty","https://picsum.photos/200/200/?random=15"
"16","Nature cost red list newspaper","475.46","Quality several red decision assume successful her however modern along various century energy reduce old with left spring order goal party threat difference police identify carry minute","false","Health and Beauty","https://picsum.photos/200/200/?random=16"
"17","Huge heart","170.56","Probably sound policy history blood whose marriage kid several scientist relate woman strategy physical campaign store middle once news develop news like today wait work more","false","Health and Beauty","https://picsum.photos/200/200/?random=17"
"18","Some man","218.05","Long star street line loss morning pretty live whether every also will because could event subject first pretty","true","Health and Beauty","https://picsum.photos/200/200/?random=18"
"19","Direction message age hand","92.39","Listen certain thus hair seven work fill him protect information task light result nothing college thought time peace commercial image him soldier","false","Fashion and Apparel","https://picsum.photos/200/200/?random=19"
"20","Then prepare fight crime","484.88","She determine action who special factor spend take would wind method gun go base sign this strong against carry someone west their free baby opportunity","false","Fashion and Apparel","https://picsum.photos/200/200/?random=20"
"21","Size oil popular order","223.69","Into however his put money kind quickly grow make free month town big person conference type start if well arm","true","Home and Garden","https://picsum.photos/200/200/?random=21"
"22","So yet fact","315.61","Since present guy community already leader it hard according east threat year day society him film ahead skin past head","false","Fashion and Apparel","https://picsum.photos/200/200/?random=22"
"23","Toward fast spring produce general","310.40","Over red teach time information since both very along son make time since meet news economic make require score when seven","true","Fashion and Apparel","https://picsum.photos/200/200/?random=23"
"24","Significant first sing","419.05","Raise report heart heart that American life picture surface TV it ask information season eat indicate part language travel option writer reach risk painting camera film","false","Fashion and Apparel","https://picsum.photos/200/200/?random=24"
"25","They film leader edge clearly","480.65","Until American need outside who respond plant environmental time option a police team better court name among hold official early surface between soon decide","true","Health and Beauty","https://picsum.photos/200/200/?random=25"
"26","Start class send affect","128.10","Later everybody think American several theory people culture ability beat still politics","false","Home and Garden","https://picsum.photos/200/200/?random=26"
"27","Beyond drop","42.80","Conference someone relate modern owner it message meeting free even high body a senior them general","false","Health and Beauty","https://picsum.photos/200/200/?random=27"
"28","Though another","93.12","Grow story alone forward wait occur first test senior area third truth matter physical identify garden piece sign","false","Electronics","https://picsum.photos/200/200/?random=28"
"29","Game including all TV imagine","88.45","Source dream ok war actually official significant name east than parent indicate kid this purpose wrong provide blue manage player administration choose population","true","Books and Media","https://picsum.photos/200/200/?random=29"
"30","Create chair they","20.26","Nice resource decade attack child sister current sister what religious southern size run reason act left","false","Home and Garden","https://picsum.photos/200/200/?random=30"
"31","Should keep","373.22","Technology avoid less food study hit brother reach consider treat road science find west include environment president station visit indeed school because until across","false","Home and Garden","https://picsum.photos/200/200/?random=31"
"32","Notice play green understand","258.64","Agree guy star film these issue everyone camera drug partner daughter wind term manager well area probably line","true","Electronics","https://picsum.photos/200/200/?random=32"
"33","Beyond such offer much charge","291.84","Size center pretty else pass tonight stuff learn exactly reach difficult represent deal strong always single test operation development","true","Electronics","https://picsum.photos/200/200/?random=33"
"34","Owner avoid especially writer air","193.53","New into toward six sing evidence fact purpose officer about student half buy successful government other situation reflect new choose adult opportunity style","true","Fashion and Apparel","https://picsum.photos/200/200/?random=34"
"35","Every others election","154.07","Certain director good toward street process work low plan education which important visit article audience story debate provide with style kind win safe question week","true","Fashion and Apparel","https://picsum.photos/200/200/?random=35"
"36","Song make available","467.05","Mrs usually throughout would professional gun describe nature often smile serious final develop","false","Fashion and Apparel","https://picsum.photos/200/200/?random=36"
"37","Unit gas personal","499.06","Subject possible first Mr another travel administration continue author major six your may","true","Fashion and Apparel","https://picsum.photos/200/200/?random=37"